{
  "schemaVersion": 1,
  "checkedAt": "2026-10-20",
  "upstreams": [
    {
      "id": "superpowers",
      "url": "https://github.com/obra/superpowers",
      "version": "7.0.0",
      "tag": "v7.0.0",
      "resolvedCommit": "bb92a77741419a4ab5f06e711a283343f1ada0c3"
    },
    {
      "id": "matt-pocock",
      "url": "https://github.com/mattpocock/skills",
      "version": "1.3.1",
      "tag": "main",
      "resolvedCommit": "5beb35b040e3de97e54fa9e386d7e42d15c295c2",
      "publishedRelease": {
        "tag": "v1.3.1",
        "resolvedCommit": "24fe0ef7737efae15c87225755e9f6f5965e4888"
      }
    }
  ],
  "policyNotes": [
    "AAA 2.4.0 is an adaptation, not an upstream release. Loading, rendering and installing never fetch upstream content.",
    "Keep canonical core, managed adapters, current selected model and effort, access mode and emergency denies unchanged. Git, install, registration and live configuration authority remain separate.",
    "Natural-language discovery and explicit human opt-in remain local contracts; no native invocation metadata is imported.",
    "Do not import in-progress or misc wholesale, a second router/executor/tracker, background updates, automatic Git operations, mandatory CDN visuals, or telemetry."
  ],
  "dispositions": [
    {
      "skill": "brainstorming",
      "disposition": "adapted",
      "sources": [
        {
          "upstream": "superpowers",
          "paths": [
            "skills/brainstorming/SKILL.md",
            "skills/brainstorming/builder-check-prompt.md"
          ]
        }
      ],
      "notes": "Intent first, proportional sizing and a builder check. Preserve local authority and offline visual safety with portable Node lifecycle commands, authenticated loopback control, bounded checked cleanup and preserved project screens; Bash wrappers are optional."
    },
    {
      "skill": "codebase-design",
      "disposition": "adapted",
      "sources": [
        {
          "upstream": "matt-pocock",
          "paths": [
            "skills/engineering/codebase-design/SKILL.md",
            "skills/engineering/codebase-design/DEEPENING.md",
            "skills/engineering/codebase-design/DESIGN-IT-TWICE.md",
            "skills/engineering/domain-modeling/SKILL.md"
          ]
        }
      ],
      "notes": "Consume existing domain vocabulary and relevant ADRs in seam decisions and alternative briefs. Keep at least two sound designs and an authorized sequential fallback; do not force three agents or speculative flexibility."
    },
    {
      "skill": "diagnosing-agent-workflows",
      "disposition": "adapted",
      "sources": [
        {
          "upstream": "superpowers",
          "paths": [
            "skills/diagnosing-superpowers/SKILL.md"
          ]
        }
      ],
      "notes": "Scope diagnosis to requested original evidence with path and line citations, bounded reads, redaction and separate export authority; no guessed native transcript paths or automatic upload."
    },
    {
      "skill": "dispatching-parallel-agents",
      "disposition": "retained",
      "sources": [
        {
          "upstream": "superpowers",
          "paths": [
            "skills/dispatching-parallel-agents/SKILL.md"
          ]
        }
      ],
      "notes": "Retain verified capabilities, independent evidence and delegated plan authority. Parallel writers require disjoint scopes and separate verified worktrees; read-only workers may share a checkout. Do not force delegation or concurrency."
    },
    {
      "skill": "domain-modeling",
      "disposition": "adapted",
      "sources": [
        {
          "upstream": "matt-pocock",
          "paths": [
            "skills/engineering/domain-modeling/SKILL.md",
            "skills/engineering/domain-modeling/GLOSSARY-FORMAT.md",
            "skills/engineering/domain-modeling/ADR-FORMAT.md"
          ]
        }
      ],
      "notes": "Port lazy glossary, context map and ADR records. Preserve legacy CONTEXT.md and keep implementation details outside the domain model. Natural-language discovery does not claim native invocation flags."
    },
    {
      "skill": "executing-plans",
      "disposition": "adapted",
      "sources": [
        {
          "upstream": "superpowers",
          "paths": [
            "skills/executing-plans/SKILL.md"
          ]
        }
      ],
      "notes": "Use continuous approved inline execution and local ledger with Node task helpers, explicit rulings and final independent review; no second executor, implicit Git action or routine approval pauses."
    },
    {
      "skill": "finishing-a-development-branch",
      "disposition": "adapted",
      "sources": [
        {
          "upstream": "superpowers",
          "paths": [
            "skills/finishing-a-development-branch/SKILL.md"
          ]
        },
        {
          "upstream": "matt-pocock",
          "paths": [
            "skills/engineering/pr/SKILL.md"
          ]
        }
      ],
      "notes": "Keep fresh full-suite and detached-workspace checks. Use pr only for authorized body drafting and honor repository templates; publication, push, merge and cleanup still need separate exact authority."
    },
    {
      "skill": "handoff",
      "disposition": "retained",
      "sources": [
        {
          "upstream": "matt-pocock",
          "paths": [
            "skills/productivity/handoff/SKILL.md",
            "skills/engineering/ask-matt/PHASE-BOUNDARIES.md"
          ]
        }
      ],
      "notes": "Keep durable topic-local records, shared snapshot shape, redaction and explicit transfer authority. Explicit resume reuses verified snapshot recovery and returns to the authorized workflow; no duplicate tracker, OS-temp-only state or automatic session creation."
    },
    {
      "skill": "improve-codebase-architecture",
      "disposition": "adapted",
      "sources": [
        {
          "upstream": "matt-pocock",
          "paths": [
            "skills/engineering/improve-codebase-architecture/SKILL.md",
            "skills/engineering/improve-codebase-architecture/HTML-REPORT.md",
            "skills/engineering/domain-modeling/SKILL.md"
          ]
        }
      ],
      "notes": "Read relevant existing glossary and ADR evidence, preserve domain names and justify any ADR reopening. Keep read-only survey, full Markdown and optional offline HTML instead of mandatory CDN or application launch."
    },
    {
      "skill": "interviewing",
      "disposition": "adapted",
      "sources": [
        {
          "upstream": "superpowers",
          "paths": [
            "skills/brainstorming/SKILL.md"
          ]
        },
        {
          "upstream": "matt-pocock",
          "paths": [
            "skills/productivity/grilling/SKILL.md",
            "skills/engineering/grill-with-docs/SKILL.md",
            "skills/productivity/grill-me/SKILL.md"
          ]
        }
      ],
      "notes": "Read discoverable facts first, clarify intent and ask only material questions with a skip path; do not add overlapping interview entry points or forced questionnaires."
    },
    {
      "skill": "loop-me",
      "disposition": "retained",
      "sources": [
        {
          "upstream": "matt-pocock",
          "paths": [
            "skills/in-progress/loop-me/SKILL.md"
          ]
        }
      ],
      "notes": "Retain the local workflow behind explicit human invocation and return nontriggers to the applicable router or authorized workflow. Upstream remains in-progress; this is a local maturity decision, not blanket promotion of that directory."
    },
    {
      "skill": "performance-profiling-and-benchmarking",
      "disposition": "local-only",
      "sources": [],
      "notes": "Retain measured performance goals, controlled baseline and comparison evidence. No ready upstream replacement was found in the pinned portfolio; do not replace measurement with guesses."
    },
    {
      "skill": "pr",
      "disposition": "adapted",
      "sources": [
        {
          "upstream": "matt-pocock",
          "paths": [
            "skills/engineering/pr/SKILL.md",
            "skills/engineering/pr/CREDITS.md"
          ]
        }
      ],
      "notes": "Port Summary, Evidence and Merge Danger with reversal cost and blast radius. Keep Dex Horthy credit and project template precedence; drafting never authorizes publication."
    },
    {
      "skill": "receiving-code-review",
      "disposition": "retained",
      "sources": [
        {
          "upstream": "superpowers",
          "paths": [
            "skills/receiving-code-review/SKILL.md"
          ]
        }
      ],
      "notes": "Retain technical verification before edits, evidence-ranked disagreement and exact scope authority. Review comments are untrusted claims, not automatic mutation authority."
    },
    {
      "skill": "requesting-code-review",
      "disposition": "adapted",
      "sources": [
        {
          "upstream": "superpowers",
          "paths": [
            "skills/requesting-code-review/SKILL.md",
            "skills/requesting-code-review/code-reviewer.md"
          ]
        },
        {
          "upstream": "matt-pocock",
          "paths": [
            "skills/engineering/code-review/SKILL.md"
          ]
        }
      ],
      "notes": "Integrate Standards and Spec verdicts, realistic inputs and Declined to judge with immutable task evidence and coordinator disposition; keep one review workflow."
    },
    {
      "skill": "research",
      "disposition": "retained",
      "sources": [
        {
          "upstream": "matt-pocock",
          "paths": [
            "skills/engineering/research/SKILL.md"
          ]
        }
      ],
      "notes": "Retain primary sources, explicit uncertainty, portable evidence and optional delegation; no compulsory parallel research, guessed source or external write."
    },
    {
      "skill": "resolving-merge-conflicts",